{
  "experiment_plan_id": "EXP-8001",
  "framework_version": "analysis_robustness_v1.0",
  "generated_at": "2026-05-09T10:40:00Z",
  "limitations": [
    {
      "claim_boundary": "Supports workflow validation only, not a domain claim.",
      "impact": "medium",
      "limitation": "Robustness output is illustrative until replaced by project-owned analysis output.",
      "mitigation": "Replace with real project robustness checks before result acceptance."
    }
  ],
  "planned_checks": [
    {
      "check_family": "holdout",
      "decision_impact": "supports_claim",
      "hypothesis": "Candidate result remains directionally similar under an adjacent validation window.",
      "limitation": "One adjacent window does not prove stability across all future periods.",
      "metric_refs": [
        "analysis_metrics.candidate_metrics[0]",
        "analysis_metrics.validation_metrics[0]"
      ],
      "name": "Alternative validation window",
      "planned_check_ref": "experiment_plan.robustness_checks[0]",
      "result": "Candidate remains better than the planned baseline in the adjacent window.",
      "status": "pass"
    }
  ],
  "run_id": "RUN-8003",
  "schema_version": "1.0",
  "summary": {
    "overall_status": "pass",
    "review_notes": "Fixture robustness supports a bounded predictive-improvement claim only.",
    "strongest_supported_claim": "predictive"
  },
  "task_id": "TASK-8003"
}
